id,text,lack_of_empathy_pred,lack_of_empathy_gold
eng_09762e07b2cdc3978cf4a4898d90be7c,My Reb conspiracy theory is that they are being Ratatouilled by a possum,1,1
eng_14040cc20044ac556adafb2f94bbf7d6,Stephen Miller daydreaming about mass deportation.,1,1
eng_16d947e688dc4373b262c9312a4e2a51,"Its not ""the antigenocide wing"". There isnt a genocide except via twisting that term. Use of it reflects preexisting ideological commitment hatred of Jewish selfdetermination. Amnesty said in 2022 Israel shouldnt be a Jewish state. This is just a rhetorical escalation of propaganda",1,1
eng_1900027792f64690e0ba3973166bea62,"So the ethnic cleansing is cancelled, then? You gotta be more clear than this.",1,1
eng_1fbc9794ed2812edc299ecdb71ad975e,The medical field has been coopted by the radical gender ideology,1,1
eng_20fc527d9dc4c6c7b0a18721cf8d8a83,USA taking in 100k refugees like we not a country full of poor refugees,1,1
eng_215567b15a128e428d09b77a4e7e1070,Zionism Apartheid and illegal settlements and genocide. AntiZionism Humanity and truth. FUCK ZIONISM. ITS RUINING AMERICA.,1,1
eng_23e91be74e7bfe0f29e05eed4d70780e,We can arrange your deportation to India,1,1
eng_23e9f7aa08bc3fac81fc320280116d98,"teh shared values in this case are, colonization, ethnic cleansing, massacres, and cultural genocides.",1,1
eng_28b2caee950c9f36bf977347ad53c567,Defund the Stockton Police Department DefundThePolice,1,1
eng_28d321f0cf8a5596b2a96266932b55e7,NO PUTIN NO RUSSIA ASSASSIN PUTIN ASS HOLE PUTIN,1,1
eng_2b4f93a36ba95cab5d471fa75de0b6d3,"Support the asexuals? Whats next, supporting xenophobia?!",1,1
eng_2c44d1c411d0454a98763b47bc92e012,Fuq Colonialism Fuq Capitalism Fuq Organized Religion,1,1
eng_31d213aa48919a620b7cb0e5010dcdbd,Illegal immigration hurts the working class people people of color the most. Illegals should return to their home countries.,1,1
eng_344b089cbfc771ee685d596fde02dfb1,"Yes, this is what happens when you start a war, civilian casualties. That happens in every war, not just the ones the Jews are involved in. Complain to Hamas.",1,1
eng_38fbd6a81fe0bbdcb568a401e642e364,Gender ideology is a pedophile movement,1,1
eng_38fe24396ed866fbfefc46d36886fc6b,So youre a socialist? Good to know. Its never worked. Move somewhere else to try it.,1,1
eng_3a336fc6bc6fda586663750599d8d928,So NOW you want to defund the police?,1,1
eng_3b299ad4036e414868c7d324125add10,Open borders and fentanyl for everyone!!,1,1
eng_41f86e299ff7c964ff63a517bd0327a0,Defund the police and use the money to help the community. DefundThePolice,1,1
eng_43b22ccd81b11d91d13b7e073a04d39c,If theres no uprising against Trump Elon soon then Americans dont deserve the second amendment.,1,1
eng_495311e8b078a2a6f01b5cf2463d6845,"""Gender Ideology"" the existence of trans people. Call it what it is, a call to eliminate trans people entirely.",1,1
eng_497ea7dcdc8ba6e55a61f40fb9079e38,zionism is FASCISM. say things right. also if they are inconvenient,1,1
eng_49d5f108d4befd22bafe6b37127d705d,I propose no president should be allowed to play golf anymore. Fuck golf. And capitalism. Especially capitalism. But golf courses are fucking terrible too.,1,1
eng_57f5eb97c2e43e718335b240053ef524,I cant believe the roman empire embraced radical gender ideology by naming regions TRANS alpine gaul and CIS alpine gaul s,1,1
eng_5c89253ec6539ca0be5bf03e6c8ce450,A stolen election may result in us getting nuked.,1,1
eng_5ca18e380ee097a8220ae047c31d7121,And also was a failure on day 1 in office regarding israel. Read history. Propping up an apartheid state didnt start on Oct 7,1,1
eng_619be160ebafa048b051c064f58ab95a,May his deportation be swift and merciless,1,1
eng_61cb25cd5f0336fd5e74249e5b4bbe81,Crying Hamas while murdering children doesnt make them less murdered. Yes Hamas did terror. And what did Israel do? Murder tens of thousands. You saying Hamas Hamas Hamas does not change the fact that Israel been murdering Palestinians for 70 years,1,1
eng_6392118a28667ecfa4108625206f9b27,These Foreigners are Ass Kissers because they Scared of Deportation,1,1
eng_68a23921f5bf1efbcb17a1e8b4c3e727,Drop the Jewish state shit it only allows antisemitic to propagate by attaching Israels crimes to Jewish people as a whole,1,1
eng_6ab2e8a6c38d2e0012c3c0a12eddc0de,Yes. The Iranian theocracys use of its Gazan subjects as human shieldsdisposable martyrs amounts to actual genocide its aggression against Israel was attempted genocide. I hope they hang for this.,1,1
eng_6d15317a59344e70726d41fb5f2dd96a,"Free Palestine, fuck Israel forever",1,1
eng_735390f1e0263827c94478792961e771,"Not only genocide denial, but genocide justification. Get in the bin",1,1
eng_7401055ead5f0f6d5ebbd4791a18c0cf,Why are you Zionism splaining to Jews?,1,1
eng_7ac19142d25541a96a0ee19efac53615,Tfw you aid genocide by voting for the most ridiculous definition of anti semitism known to man,1,1
eng_7c6380f4c695673607a82fc85a9cc6d2,Its America. Every downscale white guy thinks tomorrow they will be the next Elon Musk. Populism is entertaining that mass delusion by hurting the people blamed for its failure.,1,1
eng_7d5955be61c722f03dc1a34ce4149630,"Will you didnt .bsky.social or youd understand the TRUcuntMP team basically challenged the voting rights of 3,500,000 voters. One butch challenged 32,000 she never met from swing states. But Democrats couldnt do the same kind of campaign so fuck you comment on whites women.",1,1
eng_7efbbc846aab1b5d5aba2468499185c2,"The United States should have stepped in and stopped Israel from bombing Gaza almost immediately. It was clear within about a month that Israel was moving far beyond ""defense"" and toward a vengeful collective punishment. By March, it was clear they were engaged in ethnic cleansing.",1,1
eng_8002422350717d25bd4e070e5d10aec6,Fight like hell? All you do is support terrorists that are openly homophobic and name calling anyone who disagrees with you while advocating for the destruction of the only Jewish state,1,1
eng_80c317d70f56a26166a48672ed06b216,The Nadesalingam family are not asylum seekers. Change my mind.,1,1
eng_863a679b501ff1cf627a06bf5c4c9a75,Kamala Harris lost cause she retarded asf.,1,1
eng_87565962d029762a24f291b8c7ae5044, Is anyone gonna tell Orange Man that if Canada is the 51st state we dont need no border security?,1,1
eng_896a59b80fe838ce44dfbb354a662f93,It should be deportation to his ancestral country of origin!,1,1
eng_89d7a3f6a6e68e0c990ddc0b4c232aa3,Free us from APAIC and Apartheid Ethnic Cleansing Zionist Israhell,1,1
eng_8bc20aba21e50682fed50e4a56912171,Respect from Canada! Screw Donald Trump!,1,1
eng_8c1cf4c5efa3eb623305072ea355094a,me for president. open borders and free guns for everybody,1,1
eng_8f1a268d1edb6580019442b6b0f94231,A moral abomination imposed by Israel on the Palestinians as an obvious act of collective punishment.,1,1
eng_8f711b7ef79219a2081eaf3d4a387999,"Israel has a place, just not as a Jewish apartheid state. The IDF needs to front up for its war crimes as well.",1,1
eng_904a957b4d89fd5142ec332ba34754e9,"Russia wont kill civies its been proven video after video, stop using civilians as human shields !",1,1
eng_9b3c2450b36cad4730d7a8343ec39f61,What a great way increase genuine anti Semitism everywhere while drowning it out with their nationalism,1,1
eng_a192c0f847fc1e0f06534b07e8533161,Basically the leftist narrative always conveniently leaves out that 1 there was a war in 1947. 2_ The war happened because the entire arab world did not accept peaceful coexistence with a jewish state. Fuck around and find out. Wars often create refugees.,1,1
eng_aa85a787fac2af36752bf54307716ab6,Trumpism stole my family and friends.,1,1
eng_b9c8d997d5e8c0f300124107bfa728e7,"Israel is an apartheid state officially, which means any retaliation or attack against an apartheid state should be praised.",1,1
eng_bafa157f188a72850e5641bf1dd5df2b,PUTIN UKRAINIAN AUTHORITIES TOOK CIVILIAN POPULATION AS HUMAN SHIELDS TOOK FOREIGN STUDENTS HOSTAGE,1,1
eng_bd079ccb6d2a54da2bfc47336f5fd8bc,Plz there is happening an ethnic cleansing in Asf. StopHazaraGenocide,1,1
eng_c7513cf078e6c3fb091d250197a6c4e2,"Most Waffle Houses are located in ""RED"" states. I hope MAGA enjoys the lowering of egg prices.",1,1
eng_cde29b5c94a105668e3ee750125259aa,Fuck people who oppose the Second Amendment,1,1
eng_cf9ad9342d2ccfa4094a41dd820138ef,"just having a little lighthearted fun, chosen ahole style ""Jewish settler opens fire at Palestinian schools in West Bank""",1,1
eng_cfaea85c83d621df00d5eab475fd80d9,I guess their antiimmigration policy does not include Indians,1,1
eng_d0066dc5ac77bac1d62888cb47147ddf,if you hate capitalism just say youre broke,1,1
eng_d1f5486314d6f63c9bad53a60ebefa16,"Genocide, Apartheid, ethnic cleansing. Israel is a crime",1,1
eng_d29d0e6b59a28ea84f7d701337285820,"Remember, if the police have no duty to protect you, their only purpose is to be used against you. DefundThePolice",1,1
eng_d4f08c009aad0860f4289c11fa1f6dd4,So you have no issue with ethnic cleansing?,1,1
eng_d58d381bbb5b0e8f3b4f83f1fa2a74d4,The stated aim of the US political elites is to pacify Whites through ethnic cleansing.,1,1
eng_d5f3c8b1c027e3fec93b864057866add,Even with extra votes from The Villages Trump still couldnt beat Joe maga trump JoeBiden voterfraud,1,1
eng_d6dbe801006609a22d11f9b665fdf490,"Noones holding elections because theyve been under military occupation since the last one, but you dont want to pay attention to that because it distracts you from jerking off to dead brown babies",1,1
eng_d73d1e7330d16282d394840fd4a22c82,"More than 700.000 stinky terrorists settlers r living on stolen land. Thats an act of war itself, means military occupation, checkpoints fking w palestinians lives. Ergo Israel is the only one responsable of all the violente there. The ICJ has made it clear, get out then u can give moral lessons",1,1
eng_d845e6b7db9b546012645603e8e0a226,The context is that Israel is a settler colonial apartheid state.,1,1
eng_dc15d9d56d6b3d9c97d1f8390ebeebed,"You left out armed guards, human shields and forced religion",1,1
eng_df0ba4a12ba9d2cf3f9efb4999cd0e7f,"The other way around actually, the US uses American tax money to fund Israels Iron Dome, Free Healthcare, and Free University Education. Thats 3.8 billion dollars each year for nothing in return, really.",1,1
eng_e6c7c96f0224d4e58622f3a277a6ebd7,Oh also illegal immigration has decreased. But caravans and Haitians eating pets you know,1,1
eng_ecb665152817a2630c4a668211de48fa,"free palestine, fuck the western colonialism and their beneficiaries enablers and supporters.",1,1
eng_ecfee934e42b0ab3ea33a57da76348ac,The only solution I can see now is forced deportation,1,1
eng_f00c2e7e75d7514b050bcfe58b19c67b,Hamas doesnt want peace and they use their own people as human shields.,1,1
eng_f97621c62127822c7ec1de4196a4d091,"Azov cowards are desperates,they dont allow civilians to evacuate,because they will be annihilated without human shields.",1,1
