id,text,extreme_language_pred,extreme_language_gold
fas_e0cc8d6ce3343dd5bfe5b427cd0edfd2,انفجار یا ترور هدفمند در یک برج مسکونی در بزرگراه همدانی تهران، حوالی دریاچه چیتگر، منطقه ۲۲ با ۲۳ امتیاز و ۰ نظر فرستاده شده در بالاچه سیاسی,0,1
fas_e2d4be2337bb6dd609749127206f3869,نه بابا ترسناک بود، خواننده زن با حجاب کامل و لباس سنتی,0,1
fas_e2eb5bda38057c54d2cc6310d719e18f,دکتر ی جوری تحویلمون گرفته که میخام دفعه بعد رفتم ی گونی پسته ببرم براش.,0,1
fas_e405bfd938fc4a0ec1740a18b5a651b7,ریدممم ادم با مسی ازدواج میکنه مثل طرفه,0,1
fas_e54f0101b9a04f09054b2c47727799da,رژیم صهیونیستی در عملیات‌های ترور هدفمند خود از سیستم‌های پیشرفته هوش مصنوعی مانند لاوندر (lavender) برای شناسایی و حذف مقامات نظامی و دانشمندان استفاده می‌کند. این سیستم‌ها با تحلیل حجم بالایی از داده‌ها و شناسایی روابط بین افراد، دقت عملیات‌های ترور را به میزان قابل توجهی افزایش…,0,1
fas_e78d2d669b3f13e972521c02cb2652c9,به معنی برتری وطن پرستان بر چپ های افراطی،کمونیست ها اصلاح طلبان و قرار گرفتن مبارزه در مسیر درست تا رفراندوم و رای واقعی مردم ...,0,1
fas_ec1a64604fa961afec83785c64c6250b,خب دزدیده شده. خمینی در نوفل لوشاتو از ولایت فقیه عبور کرد و وعده جمهوری فرانسه را به مردم داد. مگر همین الآن هر حرکتی توی ایران اتفاق می افتد عده ای حاضر و آماده نیستند که فوری آن را به نام خود مصادره کرده و بر امواج انقلاب سوار شوند؟ این دزدی انگار رفته توی ژنِ برخی.,0,1
fas_ec8e71ea4ecb646037dec4bc91a4de66,در هر نقطه ای با این شکل و شمایل از خودروها مواجه شدین مراتب را سریعا به جامعه اطلاعاتی اطلاع دهید! این خودروها توسط عناصر نفوذی و خرابکار به عنوان خودرو حمل پهپاد بکار گرفته می شود,0,1
fas_ecc977cdcbb8e9362a9cdd48102da968,فقط بخاطر حرف مسی که انقدر شهامت نداشته تو روت بگه ؟؟؟؟ اینجوری روت تاثیر داره ؟,0,1
fas_f5b22ea7c68386312dfa10dca4ea46d4,آفرین به نکته ریزییییی اشاره کردی  ولی اگه مهریه جز سکه چیزی تعیین کردی قبول کرد اون معلوم مهم هستید,0,1
fas_f816ca2835975e1086e931d86d9f77b9,با حجاب قوی که گذاشتی زید خارجی کامنت گذاشته دیگه چی میخوای😅,0,1
fas_fab69c0bb57bf0478b63d746f7c57216,اعتصاب پرستاران بیمارستان میلاد از هر زاویه که بهش نگاه کنی وحشتناکه!اول اینکه کسی نیست به بیماران برسه! 😔دوم اینکه اینقدر حقوقشون کمه که حاضرن اعتصاب کنن و به بیماران نرسن! 😔,0,1
fas_fb7096ebc3b3096953a49e583c2e1619,همه کاراشو خودم کردم، مسلطم، ولی از ارائه بدم میاد حمیدرضا، اونم جلو این دولتیا، باید حجاب بپوشم و ...,0,1
fas_fc5a01d1bcd14499bb60ae2068cab322,متقابلا موافقان طرح صیانت نگران دزدی و رانت و اختلاص میلیاردی خود هستند,0,1
